{
  "version": 1,
  "type": "response",
  "game_instance_id": "11111111-1111-4111-8111-111111111111",
  "session_id": "22222222-2222-4222-8222-222222222222",
  "seq": 1,
  "sent_monotonic_ms": 3030,
  "request_id": "request-time-warp-1",
  "payload": {
    "ok": true,
    "result": {"rate": 120.0, "previous_rate": 1.0, "confirmed_frame": 2457}
  }
}
