{
  "version": 1,
  "type": "telemetry",
  "game_instance_id": "11111111-1111-4111-8111-111111111111",
  "session_id": "22222222-2222-4222-8222-222222222222",
  "seq": 12,
  "sent_monotonic_ms": 2500,
  "payload": {
    "frame_number": 2456,
    "player_time_s": 123.5,
    "delta_time_s": 0.0166666667,
    "simulation_speed": 1.0,
    "captured_monotonic_ms": 2498,
    "capabilities": {
      "control": {"exact_throttle": true, "engine_state": true, "stage": true, "set_target": true, "thrust_vector_target": true, "deadman_timeout_ms": 750},
      "dynamics": {"gravity_cci": true, "gravity_cce": true, "gravity_local": true, "total_acceleration": true, "non_gravitational_acceleration": true, "body_parameters": true},
      "propulsion": {"aggregate": true, "engines": true, "engine_positions": true, "gimbal_state": true, "gimbal_rate_limits": false, "restart_counts": false, "response_parameters": false},
      "rigid_body": {"center_of_mass": true, "inertia_tensor": true, "angular_acceleration": true, "total_force_moment": true, "propulsive_force_moment": true, "aerodynamic_force_moment": false, "rcs_force_moment": false, "torque_authority": false},
      "atmosphere": {"pressure": true, "density": true, "temperature": false, "speed_of_sound": false, "mach": false, "dynamic_pressure": true, "wind": false, "air_relative_velocity": true, "angles": false},
      "landing": {"site_definition": true, "local_frame": true, "terrain_height": false, "ground_normal": true, "surface_slope": true},
      "surface": {"ground_contact": true, "touchdown_events": true, "collision_events": false, "structural_failure_events": false, "engine_out_events": false, "propellant_exhaustion": true, "controllability": true, "contact_points": false, "landing_leg_state": false},
      "applied_control": true,
      "recording_replay": true,
      "time_warp": {"control": true, "available_rates": [0.0, 1.0, 2.0, 4.0], "ownership": "game_global_persistent", "unavailable_reason": null}
    },
    "vehicle": {
      "id": "vehicle:active:7", "name": "Mittens I", "parent_id": "body:home:1", "target_id": "body:moon:2", "target": {"id": "body:moon:2", "name": "Moon", "kind": "body", "position_cci_m": {"x": 1000000.0, "y": 0.0, "z": 0.0}, "velocity_cci_mps": {"x": 0.0, "y": 100.0, "z": 0.0}, "orbit": null}, "situation": "Flying", "controllable": true,
      "position_cci_m": {"x": 600100.0, "y": 0.0, "z": 0.0}, "position_cce_m": {"x": 600100.0, "y": 0.0, "z": 0.0}, "position_orb_m": {"x": 100.0, "y": 0.0, "z": 0.0},
      "velocity_cci_mps": {"x": -12.0, "y": 0.0, "z": 0.0}, "velocity_cce_mps": {"x": -12.0, "y": 0.0, "z": 0.0}, "velocity_orb_mps": {"x": -12.0, "y": 0.0, "z": 0.0}, "surface_velocity_cci_mps": {"x": -12.0, "y": 0.0, "z": 0.0},
      "body_to_cci": {"x": 0.0, "y": 0.0, "z": 0.0, "w": 1.0}, "body_rates_radps": {"x": 0.0, "y": 0.01, "z": 0.0}, "angular_acceleration_body_radps2": {"x": 0.0, "y": 0.0, "z": 0.0},
      "total_acceleration_body_mps2": {"x": -9.1, "y": 0.0, "z": 0.0}, "total_acceleration_cci_mps2": {"x": -9.1, "y": 0.0, "z": 0.0}, "total_acceleration_cce_mps2": {"x": -9.1, "y": 0.0, "z": 0.0}, "total_acceleration_orb_mps2": {"x": -9.1, "y": 0.0, "z": 0.0}, "gravity_cci_mps2": {"x": -9.8, "y": 0.0, "z": 0.0}, "gravity_cce_mps2": {"x": -9.8, "y": 0.0, "z": 0.0},
      "non_gravitational_acceleration_body_mps2": {"x": 0.7, "y": 0.0, "z": 0.0}, "non_gravitational_acceleration_cci_mps2": {"x": 0.7, "y": 0.0, "z": 0.0},
      "barometric_altitude_m": 100.0, "radar_altitude_m": 98.0, "inertial_speed_mps": 12.0, "surface_speed_mps": 12.0, "total_mass_kg": 10000.0, "inert_mass_kg": 7000.0, "propellant_mass_kg": 3000.0,
      "parent_body": {"id": "body:home:1", "gravitational_parameter_m3ps2": 3531600000000.0, "mean_radius_m": 600000.0, "rotation_rate_radps": 0.00029, "rotation_axis_cce": {"x": 0.0, "y": 1.0, "z": 0.0}},
      "orbit": {"eccentricity": 0.01, "semi_major_axis_m": 650000.0, "inclination_rad": 0.1, "longitude_ascending_node_rad": 0.2, "argument_periapsis_rad": 0.3, "periapsis_m": 43000.0, "apoapsis_m": 57000.0, "period_s": 1800.0}
    },
    "propulsion": {
      "requested_throttle": 0.5, "applied_throttle": 0.48, "minimum_throttle": 0.1, "maximum_throttle": 1.0,
      "current_thrust_body_n": {"x": 7000.0, "y": 0.0, "z": 0.0}, "current_thrust_cci_n": {"x": 7000.0, "y": 0.0, "z": 0.0}, "maximum_available_thrust_n": 150000.0, "maximum_available_thrust_body_n": {"x": 150000.0, "y": 0.0, "z": 0.0}, "maximum_available_thrust_cci_n": {"x": 150000.0, "y": 0.0, "z": 0.0}, "mass_flow_rate_kgps": 25.0, "effective_specific_impulse_s": 285.5,
      "engines": [{"id": "engine:1", "name": "Main engine", "staged_enabled": true, "ignited": true, "propellant_available": true, "requested_throttle": 0.5, "applied_throttle": 0.48, "minimum_throttle": 0.1, "maximum_throttle": 1.0, "current_thrust_n": 7000.0, "maximum_available_thrust_n": 150000.0, "current_thrust_body_n": {"x": 7000.0, "y": 0.0, "z": 0.0}, "current_thrust_cci_n": {"x": 7000.0, "y": 0.0, "z": 0.0}, "thrust_position_body_m": {"x": -5.0, "y": 0.0, "z": 0.0}, "nominal_thrust_direction_body": null, "gimbal_angles_rad": {"x": 0.0, "y": 0.01, "z": -0.01}, "gimbal_limits_rad": {"x": 0.0, "y": 0.087, "z": 0.087}, "specific_impulse_s": 285.5, "mass_flow_rate_kgps": 25.0, "restart_available": null, "remaining_ignitions": null, "gimbal_rate_limits_radps": null, "ignition_delay_s": null, "shutdown_delay_s": null, "response_time_constant_s": null, "ambient_pressure_pa": 90000.0}],
      "gimbals": [{"id": "gimbal:1", "parent_part_id": "engine:1", "angle_y_rad": 0.01, "angle_z_rad": -0.01, "limit_y_rad": 0.087, "limit_z_rad": 0.087, "rate_limit_y_radps": null, "rate_limit_z_radps": null}]
    },
    "rigid_body": {"center_of_mass_vehicle_assembly_m": {"x": 0.1, "y": 0.0, "z": 0.0}, "center_of_mass_body_m": {"x": 0.1, "y": 0.0, "z": 0.0}, "inertia_body_kg_m2": {"xx": 1000.0, "xy": 0.0, "xz": 0.0, "yy": 8000.0, "yz": 0.0, "zz": 8000.0}, "total_force_body_n": {"x": -91000.0, "y": 0.0, "z": 0.0}, "total_force_cci_n": {"x": -91000.0, "y": 0.0, "z": 0.0}, "total_moment_body_nm": {"x": 0.0, "y": 0.0, "z": 0.0}, "propulsive_force_body_n": {"x": 7000.0, "y": 0.0, "z": 0.0}, "propulsive_moment_body_nm": {"x": 0.0, "y": 0.0, "z": 0.0}, "aerodynamic_force_body_n": null, "aerodynamic_moment_body_nm": null, "rcs_force_body_n": null, "rcs_moment_body_nm": null, "positive_torque_authority_body_nm": null, "negative_torque_authority_body_nm": null, "tvc_torque_authority_body_nm": null, "rcs_torque_authority_body_nm": null},
    "atmosphere": {"pressure_pa": 90000.0, "density_kgpm3": 1.1, "dynamic_pressure_pa": 79.2, "air_relative_velocity_body_mps": {"x": -12.0, "y": 0.0, "z": 0.0}, "air_relative_velocity_cci_mps": {"x": -12.0, "y": 0.0, "z": 0.0}, "air_relative_velocity_cce_mps": {"x": -12.0, "y": 0.0, "z": 0.0}, "temperature_k": null, "speed_of_sound_mps": null, "mach": null, "wind_velocity_cci_mps": null, "angle_of_attack_rad": null, "sideslip_angle_rad": null},
    "surface": {"ground_contact": false, "landed": false, "ground_normal_body": {"x": 1.0, "y": 0.0, "z": 0.0}, "contact_count": null, "touchdown_event_seq": 0, "touchdown_vertical_speed_mps": null, "collision_event_seq": null, "structural_failure_event_seq": null, "engine_out_event_seq": null, "propellant_exhausted": false, "controllable": true},
    "landing_reference": {"site": {"body_id": "body:home:1", "position_ccf_m": {"x": 600000.0, "y": 0.0, "z": 0.0}, "latitude_deg": 0.0, "longitude_deg": 0.0, "altitude_m": 0.0}, "site_position_cci_m": {"x": 600000.0, "y": 0.0, "z": 0.0}, "site_position_cce_m": {"x": 600000.0, "y": 0.0, "z": 0.0}, "site_position_ccf_m": {"x": 600000.0, "y": 0.0, "z": 0.0}, "east_cci": {"x": 0.0, "y": 0.0, "z": -1.0}, "north_cci": {"x": 0.0, "y": 1.0, "z": 0.0}, "up_cci": {"x": 1.0, "y": 0.0, "z": 0.0}, "position_enu_m": {"x": 0.0, "y": 0.0, "z": 100.0}, "velocity_enu_mps": {"x": 0.0, "y": 0.0, "z": -12.0}, "vertical_velocity_mps": -12.0, "horizontal_speed_mps": 0.0, "distance_m": 100.0, "gravity_enu_mps2": {"x": 0.0, "y": 0.0, "z": -9.8}, "ground_normal_enu": {"x": 0.0, "y": 0.0, "z": 1.0}, "terrain_height_m": null, "radar_altitude_m": 98.0, "surface_slope_rad": 0.0, "simulation_time_s": 123.5},
    "applied_control": {"lease_active": true, "lease_id": "33333333-3333-4333-8333-333333333333", "active_mode": "thrust_vector_target", "latest_requested": {"control_seq": 7, "mode": "thrust_vector_target", "engine_on": null, "throttle": 0.5, "thrust_vector_target": {"direction_cci": {"x": 1.0, "y": 0.0, "z": 0.0}}, "monotonic_ms": 2480}, "accepted": {"control_seq": 7, "mode": "thrust_vector_target", "engine_on": null, "throttle": 0.5, "thrust_vector_target": {"direction_cci": {"x": 1.0, "y": 0.0, "z": 0.0}}, "monotonic_ms": 2481}, "applied": {"control_seq": 7, "mode": "thrust_vector_target", "engine_on": null, "throttle": 0.5, "thrust_vector_target": {"direction_cci": {"x": 1.0, "y": 0.0, "z": 0.0}}, "monotonic_ms": 2482}, "applied_game_frame": null, "applied_simulation_time_s": null, "rejection_reason": null, "saturation_reason": null},
    "manual_control": {"engine_on": true, "throttle": 0.45, "pitch": "neutral", "yaw": "positive", "roll": "negative", "translate_forward": "positive", "translate_right": "neutral", "translate_up": "negative"}
  }
}
