{
  "version": 1,
  "type": "request",
  "game_instance_id": "11111111-1111-4111-8111-111111111111",
  "session_id": "22222222-2222-4222-8222-222222222222",
  "seq": 1,
  "sent_monotonic_ms": 3010,
  "request_id": "request-time-warp-1",
  "payload": {
    "method": "time_warp.set_rate",
    "command_id": "66666666-6666-4666-8666-666666666666",
    "params": {"rate": 120.0}
  }
}
