{
  "version": 1,
  "type": "welcome",
  "game_instance_id": "11111111-1111-4111-8111-111111111111",
  "session_id": "22222222-2222-4222-8222-222222222222",
  "seq": 0,
  "sent_monotonic_ms": 2000,
  "payload": {
    "selected_version": 1,
    "session_id": "22222222-2222-4222-8222-222222222222",
    "sdk_version": "0.1.0",
    "telemetry_hz": 60
  }
}
